{
  "stage": "3.9",
  "status": "PASS",
  "score": 100,
  "tag": "scos-stage-3.9-certified",
  "implementation_commit": "pending-release-commit",
  "documentation_commit": null,
  "regression_total": 169,
  "regression_baseline": 50,
  "technical_debt": 0,
  "blocking": false,
  "previous_tag": "scos-stage-3.8-certified",
  "next_stage": "4.0",
  "certification_id": "cert_stage_3_9_release_audit",
  "date": "2026-07-02"
}
